{"allocated_cash":"100000.00","created_at":"2026-09-04T14:00:00Z","currency":"USD","experiment_id":"port-exp.dual-alpha-001","joint_constraints":{"max_gross_exposure_bps":10000,"max_single_instrument_bps":2500,"turnover_cap_daily_bps":2000},"joint_performance":{"combined_max_drawdown_bps":510,"combined_return_bps":2140,"diversification_ratio_bps":1420,"total_fee_drag":"350.50"},"order_contention_events":2,"portfolio_experiment_schema_version":1,"strategies":[{"max_drawdown_bps":510,"realized_pnl":"12400.00","strategy_id":"strat.trend.v1","strategy_version":"2026-01-01.1","target_weight_bps":6000},{"max_drawdown_bps":420,"realized_pnl":"9000.00","strategy_id":"strat.meanrev.v1","strategy_version":"2026-01-01.1","target_weight_bps":4000}]}
